{
  "schema_version": "1",
  "tool_version": "<TOOL_VERSION>",
  "status": "complete",
  "requested_refs": {
    "base": "<BASE>",
    "head": "<HEAD>"
  },
  "resolved_refs": {
    "base": "<BASE_SHA>",
    "head": "<HEAD_SHA>",
    "merge_base": "<MERGE_BASE_SHA>"
  },
  "diff": {
    "production_files_changed": 1,
    "test_files_changed": 1,
    "shared_test_infrastructure_changed": 0,
    "files_added": 0,
    "files_modified": 2,
    "files_deleted": 0,
    "files_renamed": 0,
    "production_lines_deleted": 1
  },
  "coverage": {
    "changed_executable_lines": 2,
    "covered_by_pr_untouched_tests": 2,
    "covered_only_by_pr_touched_tests": 0,
    "covered_only_by_unknown_contexts": 0,
    "uncovered": 0,
    "pr_untouched_changed_line_coverage": 1.0
  },
  "tests": {
    "outcomes": {
      "passed": 3,
      "failed": 0,
      "skipped": 0,
      "xfailed": 0,
      "xpassed": 0,
      "error": 0,
      "collected": 3
    },
    "changes": {
      "files_changed": 1,
      "nodes_added": 1,
      "nodes_removed": 0,
      "nodes_modified": 1,
      "shared_infrastructure_changed": 0
    },
    "pytest_exit_code": 0
  },
  "findings": [],
  "line_evidence": [
    {
      "path": "src/mathy.py",
      "line": 6,
      "classification": "pr_untouched",
      "covering_node_ids": [
        "tests/test_mul.py::test_mul_positive"
      ],
      "notes": []
    },
    {
      "path": "src/mathy.py",
      "line": 7,
      "classification": "pr_untouched",
      "covering_node_ids": [
        "tests/test_mul.py::test_mul_positive"
      ],
      "notes": []
    }
  ],
  "warnings": [],
  "caveats": [
    "No correctness score or automatic recommendation was produced.",
    "PR-untouched evidence means this pull request did not modify the covering test file or known related test infrastructure. It does not identify who originally authored those tests.",
    "VerifyPatch observes Git provenance. It does not prove which human or agent process wrote historical tests."
  ],
  "coverage_overrides": [
    {
      "key": "data_file",
      "value": "<COVERAGE_DATA_FILE>",
      "reason": "Isolate VerifyPatch coverage data from the customer data file."
    },
    {
      "key": "relative_files",
      "value": "true",
      "reason": "Normalize coverage paths to repository-relative POSIX paths."
    },
    {
      "key": "branch",
      "value": "false",
      "reason": "v1 contract uses line coverage, not branch coverage."
    },
    {
      "key": "parallel",
      "value": "false",
      "reason": "v1 supports a single pytest process."
    },
    {
      "key": "dynamic_context",
      "value": "",
      "reason": "VerifyPatch sets exact pytest node IDs via its plugin."
    },
    {
      "key": "core",
      "value": "ctrace",
      "reason": "Dynamic pytest node-ID contexts require the C tracer, not sysmon."
    }
  ]
}
